{
  "schemaVersion": "1.1",
  "kind": "LINE_FORMAT_TEMPLATE",
  "unitOfFlow": "bottles",
  "knownGaps": [
    "The engineering meaning of LACT and LP Prime has not yet been defined.",
    "Four additional Speed & sensors fields have not yet been named."
  ],
  "objects": [
    {
      "position": 1,
      "id": "blowmolder-1",
      "type": "BLOWMOLDER",
      "role": "CRITICAL_MACHINE",
      "processData": {
        "role": "CRITICAL_MACHINE",
        "machineType": "BLOWMOLDER",
        "equipment": { "mtbfMinutes": null, "mttrMinutes": null, "maximumSpeedBpm": null, "bufferMinutes": null },
        "geometry": { "lactMm": null, "lpPrimeMm": null, "actualDischargeMm": null, "actualCodingMm": null },
        "upstream": { "packageLengthMm": null, "dischargePitchMm": null, "startupTimeSeconds": null, "bottlesDischargedAtStop": null },
        "downstream": { "infeedPitchMm": null, "rampUpTimeSeconds": null },
        "speedAndSensors": { "conveyorSpeedFactorVsDischargeVelocityPercent": null, "codingConveyorSpeedFactorVsPreviousConveyorPercent": null, "additionalParameters": [] }
      }
    },
    {
      "position": 2,
      "id": "conveyor-1",
      "type": "CONVEYOR",
      "role": "CONVEYOR",
      "processData": {
        "role": "CONVEYOR",
        "machineType": "CONVEYOR",
        "equipment": { "mtbfMinutes": null, "mttrMinutes": null, "maximumSpeedBpm": null, "bufferMinutes": null },
        "geometry": { "lactMm": null, "lpPrimeMm": null, "actualDischargeMm": null, "actualCodingMm": null },
        "upstream": { "packageLengthMm": null, "dischargePitchMm": null, "startupTimeSeconds": null, "bottlesDischargedAtStop": null },
        "downstream": { "infeedPitchMm": null, "rampUpTimeSeconds": null },
        "speedAndSensors": { "conveyorSpeedFactorVsDischargeVelocityPercent": null, "codingConveyorSpeedFactorVsPreviousConveyorPercent": null, "additionalParameters": [] }
      }
    },
    {
      "position": 3,
      "id": "pucker-1",
      "type": "PUCKER",
      "role": "CRITICAL_MACHINE",
      "processData": {
        "role": "CRITICAL_MACHINE",
        "machineType": "PUCKER",
        "equipment": { "mtbfMinutes": null, "mttrMinutes": null, "maximumSpeedBpm": null, "bufferMinutes": null },
        "geometry": { "lactMm": null, "lpPrimeMm": null, "actualDischargeMm": null, "actualCodingMm": null },
        "upstream": { "packageLengthMm": null, "dischargePitchMm": null, "startupTimeSeconds": null, "bottlesDischargedAtStop": null },
        "downstream": { "infeedPitchMm": null, "rampUpTimeSeconds": null },
        "speedAndSensors": { "conveyorSpeedFactorVsDischargeVelocityPercent": null, "codingConveyorSpeedFactorVsPreviousConveyorPercent": null, "additionalParameters": [] }
      }
    },
    {
      "position": 4,
      "id": "conveyor-2",
      "type": "CONVEYOR",
      "role": "CONVEYOR",
      "processData": {
        "role": "CONVEYOR",
        "machineType": "CONVEYOR",
        "equipment": { "mtbfMinutes": null, "mttrMinutes": null, "maximumSpeedBpm": null, "bufferMinutes": null },
        "geometry": { "lactMm": null, "lpPrimeMm": null, "actualDischargeMm": null, "actualCodingMm": null },
        "upstream": { "packageLengthMm": null, "dischargePitchMm": null, "startupTimeSeconds": null, "bottlesDischargedAtStop": null },
        "downstream": { "infeedPitchMm": null, "rampUpTimeSeconds": null },
        "speedAndSensors": { "conveyorSpeedFactorVsDischargeVelocityPercent": null, "codingConveyorSpeedFactorVsPreviousConveyorPercent": null, "additionalParameters": [] }
      }
    },
    {
      "position": 5,
      "id": "filler-1",
      "type": "FILLER",
      "role": "CRITICAL_MACHINE",
      "processData": {
        "role": "CRITICAL_MACHINE",
        "machineType": "FILLER",
        "equipment": { "mtbfMinutes": null, "mttrMinutes": null, "maximumSpeedBpm": null, "bufferMinutes": null },
        "geometry": { "lactMm": null, "lpPrimeMm": null, "actualDischargeMm": null, "actualCodingMm": null },
        "upstream": { "packageLengthMm": null, "dischargePitchMm": null, "startupTimeSeconds": null, "bottlesDischargedAtStop": null },
        "downstream": { "infeedPitchMm": null, "rampUpTimeSeconds": null },
        "speedAndSensors": { "conveyorSpeedFactorVsDischargeVelocityPercent": null, "codingConveyorSpeedFactorVsPreviousConveyorPercent": null, "additionalParameters": [] }
      }
    },
    {
      "position": 6,
      "id": "conveyor-3",
      "type": "CONVEYOR",
      "role": "CONVEYOR",
      "processData": {
        "role": "CONVEYOR",
        "machineType": "CONVEYOR",
        "equipment": { "mtbfMinutes": null, "mttrMinutes": null, "maximumSpeedBpm": null, "bufferMinutes": null },
        "geometry": { "lactMm": null, "lpPrimeMm": null, "actualDischargeMm": null, "actualCodingMm": null },
        "upstream": { "packageLengthMm": null, "dischargePitchMm": null, "startupTimeSeconds": null, "bottlesDischargedAtStop": null },
        "downstream": { "infeedPitchMm": null, "rampUpTimeSeconds": null },
        "speedAndSensors": { "conveyorSpeedFactorVsDischargeVelocityPercent": null, "codingConveyorSpeedFactorVsPreviousConveyorPercent": null, "additionalParameters": [] }
      }
    },
    {
      "position": 7,
      "id": "depucker-1",
      "type": "DEPUCKER",
      "role": "CRITICAL_MACHINE",
      "processData": {
        "role": "CRITICAL_MACHINE",
        "machineType": "DEPUCKER",
        "equipment": { "mtbfMinutes": null, "mttrMinutes": null, "maximumSpeedBpm": null, "bufferMinutes": null },
        "geometry": { "lactMm": null, "lpPrimeMm": null, "actualDischargeMm": null, "actualCodingMm": null },
        "upstream": { "packageLengthMm": null, "dischargePitchMm": null, "startupTimeSeconds": null, "bottlesDischargedAtStop": null },
        "downstream": { "infeedPitchMm": null, "rampUpTimeSeconds": null },
        "speedAndSensors": { "conveyorSpeedFactorVsDischargeVelocityPercent": null, "codingConveyorSpeedFactorVsPreviousConveyorPercent": null, "additionalParameters": [] }
      }
    },
    {
      "position": 8,
      "id": "conveyor-4",
      "type": "CONVEYOR",
      "role": "CONVEYOR",
      "processData": {
        "role": "CONVEYOR",
        "machineType": "CONVEYOR",
        "equipment": { "mtbfMinutes": null, "mttrMinutes": null, "maximumSpeedBpm": null, "bufferMinutes": null },
        "geometry": { "lactMm": null, "lpPrimeMm": null, "actualDischargeMm": null, "actualCodingMm": null },
        "upstream": { "packageLengthMm": null, "dischargePitchMm": null, "startupTimeSeconds": null, "bottlesDischargedAtStop": null },
        "downstream": { "infeedPitchMm": null, "rampUpTimeSeconds": null },
        "speedAndSensors": { "conveyorSpeedFactorVsDischargeVelocityPercent": null, "codingConveyorSpeedFactorVsPreviousConveyorPercent": null, "additionalParameters": [] }
      }
    },
    {
      "position": 9,
      "id": "sleever-1",
      "type": "SLEEVER",
      "role": "CRITICAL_MACHINE",
      "processData": {
        "role": "CRITICAL_MACHINE",
        "machineType": "SLEEVER",
        "equipment": { "mtbfMinutes": null, "mttrMinutes": null, "maximumSpeedBpm": null, "bufferMinutes": null },
        "geometry": { "lactMm": null, "lpPrimeMm": null, "actualDischargeMm": null, "actualCodingMm": null },
        "upstream": { "packageLengthMm": null, "dischargePitchMm": null, "startupTimeSeconds": null, "bottlesDischargedAtStop": null },
        "downstream": { "infeedPitchMm": null, "rampUpTimeSeconds": null },
        "speedAndSensors": { "conveyorSpeedFactorVsDischargeVelocityPercent": null, "codingConveyorSpeedFactorVsPreviousConveyorPercent": null, "additionalParameters": [] }
      }
    },
    {
      "position": 10,
      "id": "conveyor-5",
      "type": "CONVEYOR",
      "role": "CONVEYOR",
      "processData": {
        "role": "CONVEYOR",
        "machineType": "CONVEYOR",
        "equipment": { "mtbfMinutes": null, "mttrMinutes": null, "maximumSpeedBpm": null, "bufferMinutes": null },
        "geometry": { "lactMm": null, "lpPrimeMm": null, "actualDischargeMm": null, "actualCodingMm": null },
        "upstream": { "packageLengthMm": null, "dischargePitchMm": null, "startupTimeSeconds": null, "bottlesDischargedAtStop": null },
        "downstream": { "infeedPitchMm": null, "rampUpTimeSeconds": null },
        "speedAndSensors": { "conveyorSpeedFactorVsDischargeVelocityPercent": null, "codingConveyorSpeedFactorVsPreviousConveyorPercent": null, "additionalParameters": [] }
      }
    },
    {
      "position": 11,
      "id": "case-packer-1",
      "type": "CASE_PACKER",
      "role": "CRITICAL_MACHINE",
      "processData": {
        "role": "CRITICAL_MACHINE",
        "machineType": "CASE_PACKER",
        "equipment": { "mtbfMinutes": null, "mttrMinutes": null, "maximumSpeedBpm": null, "bufferMinutes": null },
        "geometry": { "lactMm": null, "lpPrimeMm": null, "actualDischargeMm": null, "actualCodingMm": null },
        "upstream": { "packageLengthMm": null, "dischargePitchMm": null, "startupTimeSeconds": null, "bottlesDischargedAtStop": null },
        "downstream": { "infeedPitchMm": null, "rampUpTimeSeconds": null },
        "speedAndSensors": { "conveyorSpeedFactorVsDischargeVelocityPercent": null, "codingConveyorSpeedFactorVsPreviousConveyorPercent": null, "additionalParameters": [] }
      }
    },
    {
      "position": 12,
      "id": "conveyor-6",
      "type": "CONVEYOR",
      "role": "CONVEYOR",
      "processData": {
        "role": "CONVEYOR",
        "machineType": "CONVEYOR",
        "equipment": { "mtbfMinutes": null, "mttrMinutes": null, "maximumSpeedBpm": null, "bufferMinutes": null },
        "geometry": { "lactMm": null, "lpPrimeMm": null, "actualDischargeMm": null, "actualCodingMm": null },
        "upstream": { "packageLengthMm": null, "dischargePitchMm": null, "startupTimeSeconds": null, "bottlesDischargedAtStop": null },
        "downstream": { "infeedPitchMm": null, "rampUpTimeSeconds": null },